{
  "$schema": "https://json-schema.org/draft/2020-12/schema",
  "$id": "https://sherpa-ui.dev/schema/component/v1.json",
  "title": "Sherpa-UI DTCG-dialect component spec",
  "description": "Private convention (DTCG-inspired grammar: $-keys + {ref} like the token file) for describing a sherpa-* web component. NOT external-DTCG-tool interop. The plan that defined this grammar landed; this schema IS the contract now.",
  "type": "object",
  "additionalProperties": false,
  "required": ["$schema", "$type", "$name"],
  "properties": {
    "$comment": {
      "description": "Who wrote the file, for a reader: GENERATED specs say so here, as JSON has no comments.",
      "type": "string"
    },
    "$schema": {
      "description": "Points at this schema (or its URL). Free-form string so the file can name where it was validated.",
      "type": "string"
    },
    "$type": {
      "description": "The DTCG-dialect node type. At the top level a spec is always a `component`.",
      "$ref": "#/$defs/typeEnum",
      "const": "component"
    },
    "$name": {
      "description": "The code element name — always sherpa-*.",
      "type": "string",
      "pattern": "^sherpa-[a-z][a-z0-9-]*$"
    },
    "$description": {
      "type": "string"
    },
    "element": { "$ref": "#/$defs/element" },
    "anatomy": {
      "description": "The Shadow-DOM node tree the component renders. One of three forms: a single `root` node (with recursive `children`); a `roots` array, for a <template> with 2+ sibling root nodes, rendered in order; or `byTemplate`, a map of template id → that template's own roots, for a component whose templates are DIFFERENT trees rather than one tree with optional nodes. Exactly one form is present. Drives HTML generation (one <template> per templates[]). Round-trips to the real .html structure.",
      "type": "object",
      "additionalProperties": false,
      "oneOf": [
        { "required": ["root"] },
        { "required": ["roots"] },
        { "required": ["byTemplate"] }
      ],
      "properties": {
        "root": { "$ref": "#/$defs/node" },
        "roots": {
          "description": "The ordered list of sibling root nodes for a multi-root <template>. Mutually exclusive with `root`.",
          "type": "array",
          "minItems": 1,
          "items": { "$ref": "#/$defs/node" }
        },
        "byTemplate": {
          "description": "Per-template roots, keyed by template id, for a component whose extra templates are DIFFERENT trees — sherpa-input-text swaps its <input> for a <textarea>, sherpa-nav-item's `promo` renames every class, sherpa-button's `icon` drops four of five children. `showWhen` can only ADD or REMOVE a node against one shared tree, so it cannot express a changed tag, class or part, and those three components could never round-trip. Each value is that template's ordered sibling roots, exactly as `roots` is for a single template. Mutually exclusive with `root`/`roots`.",
          "type": "object",
          "minProperties": 1,
          "additionalProperties": {
            "type": "array",
            "minItems": 1,
            "items": { "$ref": "#/$defs/node" }
          }
        }
      }
    },
    "templates": {
      "description": "The <template id> list the component ships (default plus any variant/removable ids). Empty ⇒ ['default'].",
      "type": "array",
      "items": { "type": "string" }
    },
    "props": {
      "description": "The public API: data-* attributes + native (bare) attributes.",
      "type": "array",
      "items": { "$ref": "#/$defs/prop" }
    },
    "variants": {
      "description": "Named visual/state forks the design picks. Each may $ref an extension tier or a prop.",
      "type": "array",
      "items": { "$ref": "#/$defs/variant" }
    },
    "slots": {
      "type": "array",
      "items": { "$ref": "#/$defs/slot" }
    },
    "populate": {
      "description": "What populate() — or the `data` property — takes.",
      "type": "object",
      "additionalProperties": false,
      "required": ["shape"],
      "properties": {
        "shape": { "description": "The argument, as written: `[{ label, value, colorIndex? }]`.", "type": "string" },
        "description": { "type": "string" }
      }
    },
    "states": {
      "description": "Each state = a CSS selector + the token {ref}s that selector applies. CSS-owned, JS-free.",
      "type": "array",
      "items": { "$ref": "#/$defs/state" }
    },
    "capabilities": {
      "description": "Declared Web-API surface (form-association, ElementInternals, container-query, observers, JS-property mirror, …) so robustness is contract data, not implicit in the .ts.",
      "type": "array",
      "items": { "$ref": "#/$defs/capability" }
    },
    "events": {
      "type": "array",
      "items": { "$ref": "#/$defs/event" }
    },
    "tokens": {
      "description": "element.property -> token {ref}. Values are {ref} strings into the token DTCG or this spec.",
      "type": "object",
      "additionalProperties": { "$ref": "#/$defs/ref" }
    },
    "$extensions": {
      "description": "Namespaced extras (Figma names, behaviour channel, divergence). Open by design.",
      "type": "object",
      "properties": {
        "sherpa": { "$ref": "#/$defs/sherpaExtension" }
      }
    }
  },
  "$defs": {
    "typeEnum": {
      "description": "The closed set of component-spec node types.",
      "enum": [
        "component",
        "element",
        "prop",
        "variant",
        "slot",
        "state",
        "capability",
        "event"
      ]
    },
    "ref": {
      "description": "A DTCG-style reference: {path.to.thing}. Resolves against this spec or the token DTCG via the shared resolver.",
      "type": "string",
      "pattern": "^\\{[^}]+\\}$"
    },
    "refOrValue": {
      "description": "Either a {ref} or a literal value the CSS uses (e.g. a hardcoded fallback hex or keyword).",
      "type": "string"
    },
    "node": {
      "description": "One node in the Shadow-DOM anatomy tree (matches the shape compile-def.mjs walks: el/class/part/attrs/slot/component/showWhen/children). A node with only a `slot` key (no `el`/`component`) is a first-class <slot> child node: it carries the slot name plus optional `attrs` (e.g. data-accepts) and renders at its position among siblings. A `slot` key ALONGSIDE `el` is the legacy collapsed form (a lone inline <slot> child of that element, kept for byte-stable output).",
      "type": "object",
      "additionalProperties": false,
      "properties": {
        "el": {
          "description": "The native tag (button, span, div…). Omitted for an owned custom element (`component`) or a bare <slot> child node (`slot` only).",
          "type": "string"
        },
        "component": {
          "description": "An owned nested custom element rendered instead of a plain tag.",
          "type": "string"
        },
        "class": { "type": "string" },
        "part": {
          "description": "The ::part() name exposed to the light DOM.",
          "type": "string"
        },
        "attrs": {
          "description": "Static attributes rendered on the node in the template (role, type, aria-*…).",
          "type": "object",
          "additionalProperties": { "type": ["string", "boolean", "number"] }
        },
        "slot": {
          "description": "A <slot> child: '' ⇒ default slot, a name ⇒ named slot. Absent ⇒ no slot.",
          "type": "string"
        },
        "showWhen": {
          "description": "Only render this node in the named template (e.g. 'removable').",
          "type": "string"
        },
        "children": {
          "type": "array",
          "items": { "$ref": "#/$defs/node" }
        }
      }
    },
    "element": {
      "description": "The native element the component IS.",
      "type": "object",
      "additionalProperties": false,
      "required": ["tag"],
      "properties": {
        "$type": { "const": "element" },
        "tag": {
          "description": "The native tag the component's interactive root is (e.g. button).",
          "type": "string"
        },
        "attributes": {
          "description": "Native attributes set on that tag in the template (role, type, aria-*, …).",
          "type": "object",
          "additionalProperties": { "type": ["string", "boolean", "number"] }
        },
        "provides": {
          "description": "Browser-owned behaviour JS must not re-implement (from element-map.yaml provides:).",
          "type": "array",
          "items": { "type": "string" }
        },
        "stateCss": {
          "description": "CSS-native state hooks: state name -> the selector that drives it (e.g. focus-visible -> :focus-visible).",
          "type": "object",
          "additionalProperties": { "type": "string" }
        }
      }
    },
    "prop": {
      "description": "One public attribute of the component.",
      "type": "object",
      "additionalProperties": false,
      "required": ["name", "type"],
      "properties": {
        "$type": { "const": "prop" },
        "name": {
          "description": "The attribute name: data-* (kebab) or a bare native attr (disabled, name, value…).",
          "type": "string"
        },
        "type": {
          "enum": ["enum", "boolean", "string", "number"]
        },
        "kind": {
          "description": "The variant mechanism: how the prop is REALISED. content = JS writes text into the shadow DOM; style = CSS selects on it; visibility = its presence toggles a rule; behaviour = only the component's JS reads it; template = it picks a template. Native attrs may omit this. It is NOT a statement about observation — see `observed`.",
          "enum": ["style", "content", "visibility", "behaviour", "template"]
        },
        "observed": {
          "description": "true = the component lists this in observedAttributes. Independent of `kind`: a CSS-only (kind:style) attribute may still be observed, and an observed native attr needs no kind at all.",
          "type": "boolean"
        },
        "declared": {
          "description": "true = declared in the class's `static props`: observed by the base class, typed, and set by `populate({ key })` — `label` sets data-label.",
          "type": "boolean"
        },
        "native": {
          "description": "true = a bare native HTML attribute (disabled, name…), not a data-* one.",
          "type": "boolean"
        },
        "values": {
          "description": "Allowed values for an enum prop.",
          "type": "array",
          "items": { "type": "string" }
        },
        "default": {
          "type": ["string", "boolean", "number", "null"]
        },
        "description": {
          "type": "string"
        }
      },
      "allOf": [
        {
          "if": { "properties": { "type": { "const": "enum" } } },
          "then": { "required": ["values"] }
        }
      ]
    },
    "variant": {
      "type": "object",
      "additionalProperties": false,
      "required": ["name"],
      "properties": {
        "$type": { "const": "variant" },
        "name": { "type": "string" },
        "description": { "type": "string" },
        "$ref": {
          "description": "Binds this variant to a prop or an extension tier via {ref}.",
          "$ref": "#/$defs/ref"
        }
      }
    },
    "slot": {
      "type": "object",
      "additionalProperties": false,
      "required": ["name", "accepts"],
      "properties": {
        "$type": { "const": "slot" },
        "name": { "type": "string" },
        "accepts": {
          "description": "What the slot takes, from its data-accepts: HTML's content categories (text, icon, control, input, content), then the Sherpa roles a slot takes one kind of component for.",
          "type": "array",
          "minItems": 1,
          "items": { "enum": ["text", "icon", "control", "input", "content", "item", "menu", "legend", "header", "footer", "nav", "panel", "dialog", "toolbar", "badge"] }
        },
        "description": { "type": "string" }
      }
    },
    "state": {
      "type": "object",
      "additionalProperties": false,
      "required": ["name", "selector"],
      "properties": {
        "$type": { "const": "state" },
        "name": { "type": "string" },
        "selector": {
          "description": "The CSS selector that expresses the state (e.g. :host([data-state=\"on\"]), :focus-visible, :host([disabled])).",
          "type": "string"
        },
        "description": { "type": "string" },
        "tokens": {
          "description": "The token {ref}s (or literal values) the selector applies.",
          "type": "object",
          "additionalProperties": { "$ref": "#/$defs/refOrValue" }
        }
      }
    },
    "capability": {
      "description": "A declared Web-API surface the component relies on.",
      "type": "object",
      "additionalProperties": false,
      "required": ["api"],
      "properties": {
        "$type": { "const": "capability" },
        "api": {
          "description": "The capability name (e.g. js-property-mirror, container-query, ElementInternals).",
          "type": "string"
        },
        "description": { "type": "string" }
      }
    },
    "event": {
      "type": "object",
      "additionalProperties": false,
      "required": ["name"],
      "properties": {
        "$type": { "const": "event" },
        "name": {
          "description": "Unprefixed noun-verb (or a re-dispatched native name like change).",
          "type": "string"
        },
        "description": { "type": "string" },
        "bubbles": { "type": "boolean" },
        "composed": { "type": "boolean" },
        "cancelable": { "type": "boolean" },
        "detail": {
          "description": "Payload shape: field -> type name.",
          "type": "object",
          "additionalProperties": { "type": "string" }
        },
        "trigger": {
          "description": "What fires it — the native event + node it comes from.",
          "type": "object",
          "additionalProperties": true
        }
      }
    },
    "sherpaExtension": {
      "description": "Sherpa-namespaced extras. Open so new metadata can be added without a schema bump.",
      "type": "object",
      "properties": {
        "figmaName": { "type": "string" },
        "figmaNodeId": { "type": "string" },
        "category": { "type": "string" },
        "variantAxes": {
          "description": "Figma variant axes, verbatim (name + values).",
          "type": "array",
          "items": {
            "type": "object",
            "required": ["name"],
            "properties": {
              "name": { "type": "string" },
              "values": { "type": "array", "items": { "type": "string" } }
            }
          }
        },
        "booleanProps": {
          "type": "array",
          "items": { "type": "string" }
        },
        "jsProps": {
          "description": "The JS-property mirror surface (read/write reflected props).",
          "type": "array",
          "items": {
            "type": "object",
            "required": ["name"],
            "properties": {
              "name": { "type": "string" },
              "type": { "type": "string" },
              "access": { "enum": ["read", "write", "read-write"] },
              "reflects": {
                "description": "The attribute this property mirrors.",
                "type": "string"
              },
              "description": { "type": "string" }
            }
          }
        },
        "behaviour": {
          "description": "The Figma behaviour channel — runtime behaviour Figma can't model structurally.",
          "type": ["array", "string"]
        },
        "divergence": {
          "description": "Figma-vs-code divergence, mirrored from the component's thin.yaml _divergence block.",
          "type": "object",
          "additionalProperties": true
        }
      }
    }
  }
}
