{
  "$comment": "sherpa-dialog — GENERATED by scripts/generate-component-spec.mjs from its .html, .css and .ts. Regenerate it, never edit it. $extensions.sherpa is kept across regen; resync-figma.mjs owns it.",
  "$schema": "../../../schemas/component.v1.json",
  "$type": "component",
  "$name": "sherpa-dialog",
  "$description": "a modal surface on the native <dialog>: modality, ::backdrop, focus trap, ESC and top-layer come from showModal().",
  "element": {
    "$type": "element",
    "tag": "dialog",
    "attributes": {
      "tabindex": "-1"
    },
    "provides": [
      "modal",
      "focus-trap",
      "escape-close",
      "backdrop"
    ],
    "stateCss": {
      "open": "[open]"
    }
  },
  "templates": [
    "default"
  ],
  "anatomy": {
    "root": {
      "el": "dialog",
      "class": "root sherpa-border-edges sherpa-border-corners",
      "part": "root",
      "attrs": {
        "tabindex": "-1"
      },
      "children": [
        {
          "el": "div",
          "class": "header",
          "part": "header",
          "children": [
            {
              "el": "span",
              "class": "heading-text"
            },
            {
              "slot": "header",
              "attrs": {
                "data-accepts": "header"
              }
            }
          ]
        },
        {
          "el": "div",
          "class": "body",
          "part": "body",
          "children": [
            {
              "slot": "",
              "attrs": {
                "data-accepts": "content"
              }
            }
          ]
        },
        {
          "el": "div",
          "class": "footer",
          "part": "footer",
          "children": [
            {
              "slot": "footer",
              "attrs": {
                "data-accepts": "footer"
              }
            }
          ]
        }
      ]
    }
  },
  "props": [
    {
      "$type": "prop",
      "name": "data-heading",
      "type": "string",
      "observed": true,
      "declared": true,
      "kind": "content",
      "description": "— convenience header label (a slotted [slot=header] overrides it)"
    },
    {
      "$type": "prop",
      "name": "data-status",
      "type": "string",
      "observed": false,
      "kind": "style",
      "description": "— status colour cascade (critical | warning | success | info | urgent)"
    },
    {
      "$type": "prop",
      "name": "data-type",
      "type": "enum",
      "observed": true,
      "declared": true,
      "kind": "style",
      "values": [
        "modal",
        "overlay"
      ],
      "description": "— modal  | overlay — overlay fills its container and opens NON-modal, so the page beside it stays live"
    },
    {
      "$type": "prop",
      "name": "open",
      "type": "boolean",
      "observed": true,
      "native": true,
      "default": false,
      "description": "— native boolean (read reflects dialog.open; set → show()/close())"
    }
  ],
  "slots": [
    {
      "$type": "slot",
      "name": "header",
      "accepts": [
        "header"
      ],
      "description": "header region (reflects has-header)."
    },
    {
      "$type": "slot",
      "name": "",
      "accepts": [
        "content"
      ],
      "description": "the dialog body"
    },
    {
      "$type": "slot",
      "name": "footer",
      "accepts": [
        "footer"
      ],
      "description": "footer region (reflects has-footer)"
    }
  ],
  "populate": {
    "shape": "{ heading?, type? }",
    "description": "Its declared props by name: `label` sets data-label."
  },
  "states": [
    {
      "$type": "state",
      "name": "heading",
      "selector": ":host([data-heading])"
    },
    {
      "$type": "state",
      "name": "overlay",
      "selector": ":host([data-type=\"overlay\"])"
    }
  ],
  "capabilities": [
    {
      "$type": "capability",
      "api": "js-property-mirror",
      "description": "read/write JS properties (open). See $extensions.sherpa.jsProps."
    },
    {
      "$type": "capability",
      "api": "js-methods",
      "description": "callable from a view definition's state block (show, hide, close, prompt, confirm). See $extensions.sherpa.methods."
    },
    {
      "$type": "capability",
      "api": "invoker-commands",
      "description": "answers a commandfor button's command (--show, --hide). See $extensions.sherpa.commands."
    }
  ],
  "events": [
    {
      "$type": "event",
      "name": "dialog-close",
      "bubbles": true,
      "composed": true
    }
  ],
  "tokens": {
    "root.color": "{sherpa.style-content-base}",
    "root.box-shadow": "{sherpa.shadow-lg}",
    "heading-text.color": "{sherpa.theme-content-body-base}",
    "heading-text.font-size": "{sherpa.font-size-body-base}",
    "heading-text.font-weight": "{sherpa.font-weight-medium}",
    "heading-text.line-height": "{sherpa.theme-content-line-height-base}"
  },
  "$extensions": {
    "sherpa": {
      "figmaName": "Dialog",
      "methods": [
        {
          "$type": "method",
          "name": "show",
          "args": "",
          "description": "Open it: a modal goes to the top layer with a backdrop; an overlay stays in place."
        },
        {
          "$type": "method",
          "name": "hide",
          "args": "",
          "description": "Close it."
        },
        {
          "$type": "method",
          "name": "close",
          "args": "",
          "description": "`hide()`, in the native <dialog>'s spelling."
        },
        {
          "$type": "method",
          "name": "prompt",
          "args": "value = ''",
          "description": "Ask for ONE value. Its first field shows `value`; its LAST footer button answers with what the field holds, and any other button, or Escape, with null. An empty answer keeps it open."
        },
        {
          "$type": "method",
          "name": "confirm",
          "args": "ask: { heading?: string; words?: string; action?: string; critical?: boolean } = {}",
          "description": "Ask yes or no. `words` go in its first paragraph and `action` on its LAST footer button, critical when the ACTION is; what is not given stays as the markup wrote it. True for the action, false for anything else."
        }
      ],
      "commands": [
        {
          "name": "--show",
          "method": "show"
        },
        {
          "name": "--hide",
          "method": "hide"
        }
      ],
      "category": "container",
      "divergence": {
        "note": "2026-09-07 (D2/D12): split out of the former Container Type=dialog variant into a standalone component on native <dialog> (showModal → modality, ::backdrop, focus-trap, ESC free). Maps to the Figma \"Dialog\" component (Container set already split)."
      },
      "_divergence": {
        "overlayType": "2026-09-24: data-type=\"overlay\" is code-only. It fills its container (the app shell's overlay slot), opens NON-modal, and closes on ESC. Figma's Dialog has no such variant yet."
      },
      "jsProps": [
        {
          "name": "open",
          "type": "boolean",
          "description": "whether the dialog is open (delegates to <dialog>)",
          "access": "read-write"
        }
      ]
    }
  }
}
