{
  "$comment": "sherpa-breadcrumbs — GENERATED by scripts/generate-component-spec.mjs from its .html, .css and .ts. Regenerate it, never edit it. $extensions.sherpa is kept across regen; resync-figma.mjs owns it.",
  "$schema": "../../../schemas/component.v1.json",
  "$type": "component",
  "$name": "sherpa-breadcrumbs",
  "$description": "a navigation trail.",
  "element": {
    "$type": "element",
    "tag": "nav",
    "attributes": {
      "aria-label": "Breadcrumb"
    },
    "provides": []
  },
  "templates": [
    "default"
  ],
  "anatomy": {
    "roots": [
      {
        "el": "nav",
        "class": "trail",
        "part": "trail",
        "attrs": {
          "aria-label": "Breadcrumb"
        },
        "children": [
          {
            "el": "ol",
            "class": "crumbs",
            "part": "crumbs",
            "attrs": {
              "role": "list"
            }
          }
        ]
      },
      {
        "el": "template",
        "class": "crumb-tpl",
        "children": [
          {
            "el": "li",
            "class": "crumb",
            "attrs": {
              "role": "listitem",
              "data-index": "data-index"
            },
            "children": [
              {
                "el": "i",
                "class": "separator sherpa-icon-box",
                "attrs": {
                  "data-icon": "chevron-right",
                  "aria-hidden": "true"
                }
              },
              {
                "el": "a",
                "class": "link",
                "part": "link",
                "attrs": {
                  "data-text": "label"
                }
              }
            ]
          }
        ]
      }
    ]
  },
  "populate": {
    "shape": "[{ label, href? }]",
    "description": "the crumb trail; the last becomes current. Or its `<a href>` children"
  },
  "states": [
    {
      "$type": "state",
      "name": "focus-visible",
      "selector": ".link:focus-visible"
    }
  ],
  "events": [
    {
      "$type": "event",
      "name": "breadcrumb-select",
      "bubbles": true,
      "composed": true,
      "detail": {
        "href": "string",
        "index": "number",
        "label": "string"
      },
      "trigger": {
        "on": "click",
        "node": ".crumbs"
      }
    }
  ],
  "tokens": {
    "crumbs.gap": "{sherpa.display-mode-space-xs}",
    "crumb.gap": "{sherpa.display-mode-space-xs}",
    "separator.--_icon-size": "{sherpa.theme-size-icon-2xs}",
    "separator.color": "{sherpa.theme-content-body-1}",
    "link.color": "{sherpa.theme-content-link-1}",
    "link.font-weight": "{sherpa.font-weight-regular}",
    "link.line-height": "{sherpa.theme-content-line-height-small}",
    "link.border-radius": "{sherpa.display-mode-border-rounding-sm}"
  },
  "$extensions": {
    "sherpa": {
      "figmaName": "Breadcrumbs",
      "category": "content"
    }
  }
}
