{
  "$comment": "sherpa-badge — GENERATED by scripts/generate-component-spec.mjs from its .html, .css and .ts. Regenerate it, never edit it. $extensions.sherpa is kept across regen; resync-figma.mjs owns it.",
  "$schema": "../../../schemas/component.v1.json",
  "$type": "component",
  "$name": "sherpa-badge",
  "$description": "a small count: Figma \"Indicator (atom)/Type=count\". The consumer pins its Style mode, as Figma pins the instance.",
  "element": {
    "$type": "element",
    "tag": "span",
    "provides": []
  },
  "templates": [
    "default"
  ],
  "anatomy": {
    "root": {
      "el": "span",
      "class": "box sherpa-border-edges",
      "part": "box",
      "children": [
        {
          "slot": "",
          "attrs": {
            "data-accepts": "text"
          }
        }
      ]
    }
  },
  "slots": [
    {
      "$type": "slot",
      "name": "",
      "accepts": [
        "text"
      ],
      "description": "the count — data-accepts: text"
    }
  ],
  "tokens": {
    "box.min-inline-size": "{sherpa.display-mode-size-sm}",
    "box.block-size": "{sherpa.display-mode-size-sm}",
    "box.padding-inline": "{sherpa.display-mode-space-3xs}",
    "box.border-color": "{sherpa.style-border-base}",
    "box.border-radius": "{sherpa.display-mode-border-rounding-sm}",
    "box.background": "{sherpa.style-surface-base}",
    "box.color": "{sherpa.style-content-base}",
    "box.font-size": "{sherpa.font-size-body-small}",
    "box.font-weight": "{sherpa.font-weight-semibold}",
    "box.line-height": "{sherpa.theme-content-line-height-small}"
  }
}
