{
  "$comment": "sherpa-panel — GENERATED by scripts/generate-component-spec.mjs from its .html, .css and .ts. Regenerate it, never edit it. $extensions.sherpa is kept across regen; resync-figma.mjs owns it.",
  "$schema": "../../../schemas/component.v1.json",
  "$type": "component",
  "$name": "sherpa-panel",
  "$description": "a persistent inline panel (a semantic <section> card).",
  "element": {
    "$type": "element",
    "tag": "section",
    "provides": []
  },
  "templates": [
    "default"
  ],
  "anatomy": {
    "root": {
      "el": "section",
      "class": "root",
      "part": "root",
      "children": [
        {
          "el": "div",
          "class": "header",
          "part": "header",
          "children": [
            {
              "el": "sherpa-container-header",
              "class": "heading",
              "part": "heading"
            },
            {
              "slot": "header",
              "attrs": {
                "data-accepts": "header"
              }
            }
          ]
        },
        {
          "el": "div",
          "class": "body",
          "part": "body",
          "children": [
            {
              "slot": "",
              "attrs": {
                "data-accepts": "content"
              }
            }
          ]
        },
        {
          "el": "div",
          "class": "footer",
          "part": "footer",
          "children": [
            {
              "slot": "footer",
              "attrs": {
                "data-accepts": "footer"
              }
            }
          ]
        }
      ]
    }
  },
  "props": [
    {
      "$type": "prop",
      "name": "data-collapsed",
      "type": "boolean",
      "observed": true,
      "declared": true,
      "kind": "style",
      "description": "boolean; hides the body/footer, leaving the header"
    },
    {
      "$type": "prop",
      "name": "data-heading",
      "type": "string",
      "observed": true,
      "declared": true,
      "kind": "content",
      "description": "the title of a composed sherpa-container-header; a slotted [slot=header] replaces it"
    },
    {
      "$type": "prop",
      "name": "data-status",
      "type": "string",
      "observed": false,
      "kind": "style",
      "description": "status colour cascade (critical | warning | success | info | urgent)"
    }
  ],
  "slots": [
    {
      "$type": "slot",
      "name": "header",
      "accepts": [
        "header"
      ],
      "description": "header region (reflects has-header): a header of its own, in place of data-heading's"
    },
    {
      "$type": "slot",
      "name": "",
      "accepts": [
        "content"
      ],
      "description": "the panel body"
    },
    {
      "$type": "slot",
      "name": "footer",
      "accepts": [
        "footer"
      ],
      "description": "footer region (reflects has-footer)"
    }
  ],
  "populate": {
    "shape": "{ collapsed?, heading? }",
    "description": "Its declared props by name: `label` sets data-label."
  },
  "states": [
    {
      "$type": "state",
      "name": "heading",
      "selector": ":host([data-heading])"
    },
    {
      "$type": "state",
      "name": "collapsed",
      "selector": ":host([data-collapsed])"
    }
  ],
  "$extensions": {
    "sherpa": {
      "figmaName": "Panel",
      "category": "container",
      "divergence": {
        "note": "2026-09-07 (D2/D12): split out of the former Container Type=panel variant into a standalone component. A panel is a persistent, in-flow region (not floating, not a disclosure), so its native home is a plain semantic <section> — no <dialog>/<details>. Maps to the Figma \"Panel\" component (Container set already split)."
      }
    }
  }
}
