{
  "$comment": "sherpa-key-value-list — GENERATED by scripts/generate-component-spec.mjs from its .html, .css and .ts. Regenerate it, never edit it. $extensions.sherpa is kept across regen; resync-figma.mjs owns it.",
  "$schema": "../../../schemas/component.v1.json",
  "$type": "component",
  "$name": "sherpa-key-value-list",
  "$description": "a semantic definition list.",
  "element": {
    "$type": "element",
    "tag": "dl",
    "provides": []
  },
  "templates": [
    "default"
  ],
  "anatomy": {
    "roots": [
      {
        "el": "dl",
        "class": "list",
        "part": "list"
      },
      {
        "el": "template",
        "class": "pair-tpl",
        "children": [
          {
            "el": "dt",
            "class": "key",
            "part": "key",
            "attrs": {
              "data-text": "key"
            }
          },
          {
            "el": "dd",
            "class": "value",
            "part": "value",
            "attrs": {
              "data-text": "value"
            }
          }
        ]
      }
    ]
  },
  "props": [
    {
      "$type": "prop",
      "name": "data-orientation",
      "type": "enum",
      "observed": true,
      "declared": true,
      "kind": "style",
      "values": [
        "horizontal",
        "vertical"
      ],
      "description": "horizontal | vertical  No events — display only."
    }
  ],
  "populate": {
    "shape": "[{ key, value }]",
    "description": "the label/value pairs to render."
  },
  "states": [
    {
      "$type": "state",
      "name": "horizontal",
      "selector": ":host([data-orientation=\"horizontal\"])"
    },
    {
      "$type": "state",
      "name": "vertical",
      "selector": ":host([data-orientation=\"vertical\"])"
    },
    {
      "$type": "state",
      "name": "not-orientation",
      "selector": ":host(:not([data-orientation]))"
    }
  ],
  "tokens": {
    "list.row-gap": "{sherpa.display-mode-space-xs}",
    "key.color": "{sherpa.theme-content-body-1}",
    "key.font-weight": "{sherpa.font-weight-medium}",
    "key.line-height": "{sherpa.theme-content-line-height-base}",
    "value.padding-inline": "{sherpa.theme-padding-sm}",
    "value.color": "{sherpa.theme-content-body-1}",
    "value.line-height": "{sherpa.theme-content-line-height-base}",
    "value.background": "{sherpa.style-surface-base-1}",
    "value.border-radius": "{sherpa.display-mode-border-rounding-sm}"
  },
  "$extensions": {
    "sherpa": {
      "figmaName": "Key Value Pair",
      "category": "container"
    }
  }
}
