{
  "$comment": "sherpa-transfer-list — GENERATED by scripts/generate-component-spec.mjs from its .html, .css and .ts. Regenerate it, never edit it. $extensions.sherpa is kept across regen; resync-figma.mjs owns it.",
  "$schema": "../../../schemas/component.v1.json",
  "$type": "component",
  "$name": "sherpa-transfer-list",
  "$description": "a two-pane shuttle (available ↔ selected). Pool comes from populate([{ value, label, selected? }]); `selected` picks the pane.",
  "element": {
    "$type": "element",
    "tag": "div",
    "provides": []
  },
  "templates": [
    "default"
  ],
  "anatomy": {
    "roots": [
      {
        "el": "div",
        "class": "panes",
        "part": "panes",
        "children": [
          {
            "el": "div",
            "class": "pane source",
            "part": "pane",
            "children": [
              {
                "el": "h3",
                "class": "pane-heading",
                "part": "heading",
                "attrs": {
                  "id": "source-heading"
                }
              },
              {
                "el": "ul",
                "class": "pane-list",
                "part": "list",
                "attrs": {
                  "aria-labelledby": "source-heading"
                }
              },
              {
                "el": "p",
                "class": "pane-empty",
                "part": "empty"
              }
            ]
          },
          {
            "el": "div",
            "class": "moves",
            "part": "moves",
            "attrs": {
              "role": "group",
              "aria-label": "Transfer controls"
            },
            "children": [
              {
                "el": "sherpa-button",
                "class": "move",
                "attrs": {
                  "data-move": "add",
                  "data-size": "sm",
                  "data-label": "›",
                  "aria-label": "Add selected"
                }
              },
              {
                "el": "sherpa-button",
                "class": "move",
                "attrs": {
                  "data-move": "add-all",
                  "data-size": "sm",
                  "data-label": "»",
                  "aria-label": "Add all"
                }
              },
              {
                "el": "sherpa-button",
                "class": "move",
                "attrs": {
                  "data-move": "remove",
                  "data-size": "sm",
                  "data-label": "‹",
                  "aria-label": "Remove selected"
                }
              },
              {
                "el": "sherpa-button",
                "class": "move",
                "attrs": {
                  "data-move": "remove-all",
                  "data-size": "sm",
                  "data-label": "«",
                  "aria-label": "Remove all"
                }
              }
            ]
          },
          {
            "el": "div",
            "class": "pane target",
            "part": "pane",
            "children": [
              {
                "el": "h3",
                "class": "pane-heading",
                "part": "heading",
                "attrs": {
                  "id": "target-heading"
                }
              },
              {
                "el": "ul",
                "class": "pane-list",
                "part": "list",
                "attrs": {
                  "aria-labelledby": "target-heading"
                }
              },
              {
                "el": "p",
                "class": "pane-empty",
                "part": "empty"
              }
            ]
          }
        ]
      },
      {
        "el": "template",
        "class": "row-tpl",
        "children": [
          {
            "el": "li",
            "class": "row",
            "attrs": {
              "data-attr-data-value": "value"
            },
            "children": [
              {
                "el": "sherpa-list-item",
                "attrs": {
                  "data-selectable": "",
                  "data-interactive": "",
                  "data-attr-data-label": "label"
                }
              }
            ]
          }
        ]
      }
    ]
  },
  "props": [
    {
      "$type": "prop",
      "name": "data-source-heading",
      "type": "string",
      "observed": true,
      "declared": true,
      "kind": "content",
      "default": "Available",
      "description": "heading for the available pane"
    },
    {
      "$type": "prop",
      "name": "data-target-heading",
      "type": "string",
      "observed": true,
      "declared": true,
      "kind": "content",
      "default": "Selected",
      "description": "heading for the selected pane"
    },
    {
      "$type": "prop",
      "name": "disabled",
      "type": "boolean",
      "observed": true,
      "native": true,
      "default": false,
      "description": "disabled state — no move is made"
    },
    {
      "$type": "prop",
      "name": "name",
      "type": "string",
      "observed": true,
      "native": true,
      "description": "the form field its selected values are submitted under"
    }
  ],
  "populate": {
    "shape": "[{ value, label, selected? }]",
    "description": "the full item pool."
  },
  "states": [
    {
      "$type": "state",
      "name": "disabled",
      "selector": ":host([disabled])"
    }
  ],
  "capabilities": [
    {
      "$type": "capability",
      "api": "js-property-mirror",
      "description": "read/write JS properties (selected). See $extensions.sherpa.jsProps."
    },
    {
      "$type": "capability",
      "api": "js-methods",
      "description": "callable from a view definition's state block (checkValidity, reportValidity, formResetCallback). See $extensions.sherpa.methods."
    }
  ],
  "events": [
    {
      "$type": "event",
      "name": "transfer-change",
      "bubbles": true,
      "composed": true,
      "detail": {
        "direction": "'add' | 'remove'",
        "moved": "string[]",
        "selected": "string[]"
      },
      "trigger": {
        "on": "click",
        "node": ".moves"
      }
    }
  ],
  "tokens": {
    "pane.border-width": "{sherpa.display-mode-border-width-base}",
    "pane.border-radius": "{sherpa.border-rounding-top-left}",
    "pane.background": "{sherpa.style-surface-base}",
    "pane-heading.padding": "{sherpa.display-mode-space-xs}",
    "pane-heading.border-block-end": "{sherpa.display-mode-border-width-base}",
    "pane-heading.background": "{sherpa.theme-surface-default-1}",
    "pane-heading.color": "{sherpa.theme-content-body-1}",
    "pane-heading.font-size": "{sherpa.font-size-body-small}",
    "pane-heading.font-weight": "{sherpa.font-weight-regular}",
    "pane-heading.line-height": "{sherpa.theme-content-line-height-small}",
    "pane-empty.padding": "{sherpa.display-mode-space-base}",
    "pane-empty.color": "{sherpa.theme-content-body-1}",
    "row.border-radius": "{sherpa.border-rounding-top-left}",
    "moves.gap": "{sherpa.display-mode-space-2xs}"
  },
  "$extensions": {
    "sherpa": {
      "figmaName": "Transfer List",
      "methods": [
        {
          "$type": "method",
          "name": "checkValidity",
          "args": "",
          "description": "Is it acceptable, as its form sees it?"
        },
        {
          "$type": "method",
          "name": "reportValidity",
          "args": "",
          "description": "Check, and show the browser's message on the control."
        },
        {
          "$type": "method",
          "name": "formResetCallback",
          "args": "",
          "description": "A form reset puts back its first selection."
        }
      ],
      "category": "container",
      "jsProps": [
        {
          "name": "selected",
          "type": "string[]",
          "access": "read-write"
        }
      ]
    }
  }
}
